Formula for Index,Index,conceptId,Primary Source,conceptId,Secondary Source,conceptId,Source Question,GridID/Source Question Name,conceptId,Question Text,Variable Label,Variable Name,Connect Value for Select all that apply questions - Surveys Only,Variable Type,Variable Length,conceptId,Format/Value,Required,PII,Notes,Derivation Notes,Dictionary,State Attribute,Default Variable,Date added or modified,Question Type,IMS Review Notes
1,1,192505768,Recruitment,883203566,Sign in,,,,521025370,Time Stamp for when study ID is submitted by the site,Time Stamp for when study ID is submitted by the site,RcrtSI_TimeStamp_v1r0,,ISO,24,,example: 2020-07-17T15:21:26.763Z,Yes,No,"For all variables that are set to a default, they are set to a default when the study ID is submitted for active recruits",,Master Data Dictionary,No,No,3/26/21,,
2,2,192505768,Recruitment,883203566,Sign in,,,,512820379,Autogenerated flag - Recruitment type,Recruitment type,RcrtSI_RecruitType_v1r0,,Num,1,180583933,0 = Not active,Yes,No,"All Study IDs for which the sites have indicated they are actively recruiting will be flagged as 1.  This should be triggered by a combination of sending the Study IDs to the ""Get Participant Token"" API and then sending the deidentified demographic information to the ""Submit participant data"" API. Study IDs assigned a token/PIN, but who are not being actively recruited are flagged as zero (default) when the study ID is submitted. All individuals who sign-in without a valid token or pin are flagged as 2.",,Recruitment Data Dictionary,No,Yes,,,
3,3,,,,,,,,,,,,,,,486306141,1 = Active,,,,,,,,,,
4,4,,,,,,,,,,,,,,,854703046,2 = Passive,,,,,,,,,,
5,5,192505768,Recruitment,883203566,Sign in,,,,471593703,Autogenerated date/time for recruitment type flag,Time recruitment type assigned,RcrtSI_TypeTime_v1r0,,ISO,24,,example: 2020-07-17T15:21:26.763Z,Yes if RcrtSI_RecruitType_v1r0 equals 1 or 2,No,ISO to be converted to SAS format,,Recruitment Data Dictionary,No,No,3/26/21,,
6645,6645,129084651,Survey,232438133,Menstrual Cycle,,,,593467240,"Please provide the first day that your next menstrual period started. This information helps researchers figure out where your body was in the menstrual cycle on the day you donated samples. If you do not remember the exact day, please make your best guess",First day of menstrual period,SrvBlU_MENS2_v1r0,,Date,8,,MM/DD/YYYY,Yes,No,Required,,Menstrual Cycle Survey,No,,5/4/22,Special Functions,
6646,6646,129084651,Survey,206639461,All,,,,677381583,"""Completed Standalone Surveys - Biospecimen, Menstrual Cycle, DHQ, etc.""",Completed Standalone Surveys,SrvAll_StndAlSrvCompl_v1r0,,Num,3,,N/A,Yes,No,Used to populate PWA participant banner with the number of completed standalone surveys. Derived on the back end.,,Master Data Dictionary,No,No,8/10/22,,,,,,